Post ID,Comment ID,Comment Text,Author,Parent Comment ID
785540252977294,785561792975140,"I have not used it for social stories, but I could see how it would be great for that. Best way to find out is to try it.",,
785540252977294,785621456302507,Shan Thompson the simple dual prompt will help: prompt 1: teach the machine,,
785505456314107,785826479615338,"The Hype cycle by Gardner is different to the technology adoption diffusion model,
[I have included an overlay of the two curves]
You could also indicate the ‘chasm’ where a technology ‘fails’ to be taken up by the early majority..or the late majority..the laggards will never do this..as they are still discovering the use of computers ..(and calculators)",,
785514022979917,785559066308746,"Yes there are a bunch of these tools, then ones that do more specific things (assessments, activities, video creation, pdf & video summaries) so many options!",,
785514022979917,785559356308717,But of those I really like Eduaide and copilot. I also love Curipod!,,
785514022979917,785573929640593,"Education copilot isn’t active or updating. Curipod, Eduaide, and Conker.aI get my vote :)",,
785514022979917,785576379640348,"There's this website called News For Kids: https://
www.newsforkids.
ai/

It's like Newsela — leveled current events articles — but delivered in your e-mail for free. Less of the ""custom content creation"" you're talking about, but powered by AI & free.",,
785514022979917,785584936306159,"I released this yesterday in beta and very proud of it. I’ve watched what’s been built and what I’ve found hasn’t allowed direct context and limited use cases. This has over 50 direct use cases to teachers, organised and packed with additional features.
Looking for reps and testers - free trials no gimics access (word limit per month)
Www.teachersass
istantai.com.au",,
785514022979917,785590436305609,"I'm a developer working on briskteaching.c
om! It's different because it's integrated directly into Google Docs.",,
785514022979917,785598646304788,"I was part of the educationcopilo
t beta. The guys working on that are constantly updating the features. I definitely think it’s worth keeping bookmarked",,
785514022979917,785600552971264,"All the new updates and releases can be daunting. I’ve used this to help keep track of cool things in the space. This goes beyond education however.

https://
www.futurepedia.
io/",,
785514022979917,785606212970698,Alli McCrary I would also like to have the link. Thank you very much😊,,
785514022979917,785868489611137,"Ewriter AI has released new features. Try them now! 🎅 https://
ewriter.ai/",,
785429266321726,785517936312859,I’m in SA and I have registered,,
785429266321726,785519202979399,hey Chané Coetzer you can try snaprytr it is as similar as chatgpt. or you can say that a free version of chatgpt.,,
785429266321726,785521269645859,It doesnt work for cell c numbers.,,
785429266321726,785528379645148,Bard AI apparently doesn't require a phone number. I haven't tried it myself yet but others have said so.,,
785429266321726,785535576311095,I'm in SA and registered with my email address,,
785429266321726,786149149583071,"I've seen the premium number thing.

Chat GPT says...
Why was my premium number blocked?
Premium numbers are often associated with higher instances of fraud or abuse. Blocking these numbers helps us ensure platform integrity and reduce fraud and abuse.

According to the interwebs.
Premium rate means the numbers cost more to call or text than other numbers.",,
785429266321726,786243139573672,When I register an account it asks for a number to send a code and that’s when I get that message. Can it be because I use FNB as a sim card and contract?,,
785404599657526,785524662978853,so what did you learn about successful prompts for book illustrations,,
785404599657526,785549326309720,"For a games design unit, my students are using text-to-image (craiyon.com) to create concept art.",,
785404599657526,785819956282657,Which text to image generator did you use? This sounds like a great idea!,,
785404599657526,785847446279908,I taught my students to generate essay prompts for the text we're studying. This was so they have endless prompts against which they could practice planning essays responding to unseen topics.,,
785404599657526,785954326269220,My EFL students created scripts to practice the vocabulary and grammar they were learning that week. It's a speaking class so this saves us a ton of time.,,
785394892991830,785829652948354,"How to use it to create economics graphs for IB and A Level economics students

How to write sample exam papers and mark schemes for exam board specific curriculums",,
785394892991830,785832666281386,Annika Peacock is AI and self aware!,,
785394892991830,785861882945131,How you you teach high schoolers to use AI as a tool that can aid in the education and everyday life? My school has issues with students submitting it as their own. And many people are trying to shun AI. I would like to embrace AI because I don’t think it is going anywhere (much like the internet that was new in the 90s),,
785394892991830,785923326272320,"Hi Annika! It's a great idea to ask others what they would ask in your class. Ok, I think I would like to know useful prompts for my lessons, how can I use ChatGPT to design activities for the class, how can I make students to use ChatGPT in a useful and instructive way. I would be also very interested in how can I speak with my voice to ChatGPT and get an oral answer. I hope this will be of help!",,
785394892991830,785929582938361,"Could AI write a professional development course on effective uses in education...the
n could you please run it?? 🏃‍♀️ I'd sign up!",,
785394892991830,785951849602801,"Hi Annika, I'd be interested in some of the more advanced strategies like Zero Shot, and Chain of Thought... I'm interested to know how we could use it to build curriculum?",,
785394892991830,786058359592150,F,,
785394892991830,786062506258402,"I think of utmost importance is teaching our students of intellectual property concern, anything we load in there becomes part of the training data so to speak? So we have to be careful about the limits of what we allow to access. "" It is crucial to educate our students on intellectual property matters. Whatever we upload becomes a part of the training data, hence we need to exercise caution in terms of what we permit to access.""",,
785394892991830,786084602922859,Thank you for your offer. I would be interested in your lectures,,
785394892991830,786138429584143,Thank you! I’d enjoy learning more about what your offering.,,
785394892991830,786222706242382,I would love to join your class. Preferably virtual class. Appreciate it,,
785394892991830,786224542908865,Rebecca McKinney,,
785394892991830,786266949571291,"Yes, I would appreciate any AI tools.",,
785394892991830,786705206194132,I would love to join your class as well. I am transitioning into an instructor role at a rural CC this fall.,,
785394892991830,786900379507948,I have a wiestion regarding how specific plans can be done. I'm a teacher in the state of Georgia and teach first grade. Can this be done?,,
785394892991830,787309486133704,Omg I am so blown away by your background! What’s the best way to follow you??,,
785394892991830,787313989466587,I would love to take a class like this just as a means of better understanding how to investigate using AI! It would be nice to be part of a collaborative community and benefit by learning from others' questions.,,
785394892991830,787352866129366,"UAE top 40 Brands Coupon Code. Get up to 25% EXTRA OFF.
Namshi - Coupon Code - NM428 - Get 15% EXTRA OFF
Noon - Coupon Code - SYM - Get 10% EXTRA OFF
Foot Locker - Coupon Code - DRBQ - Get 10% EXTRA OFF
H&M - Coupon Code - DYAY - Get 20% EXTRA OFF
Tribe of 6 - Coupon Code - D72J - Get 20% EXTRA OFF
Under Armour - Coupon Code - UM14 - Get 10% EXTRA OFF
New Balance - Coupon Code - DJBY - Get 10% EXTRA OFF
Dailymealz - Coupon Code - DML61 - Get 15% EXTRA OFF
Sivvi - Coupon Code - PEACE93 - Get 15% EXTRA OFF
Sandro - Coupon Code - SAN27 - Get 15% EXTRA OFF
Branded Perfume - Coupon Code - BP19 - Get 5% EXTRA OFF
PATPAT - Coupon Code - 1Y7W7B - Get 15% EXTRA OFF
Bath and Body Works - Coupon Code - DNPS - Get 5% EXTRA OFF
American Eagle - Coupon Code - DOI4 - Get 8% EXTRA OFF
Agent Provocateur - Coupon Code - AP03 - Get 15% EXTRA OFF
Arabian Adventures - Coupon Code - AV9 - Get 5% EXTRA OFF
CityLaila - Coupon Code - CTL42 - Get 5% EXTRA OFF
Mamas & Papas - Coupon Code - MS11 - Get 15% EXTRA OFF
Saramart - Coupon Code - KSP - Get 15% EXTRA OFF
Mothercare - Coupon Code - D2VDB - Get 5% EXTRA OFF
Fragrance - Coupon Code - DCM119 - Get 10% EXTRA OFF
West ELM - Coupon Code - DR1U - Get 5% EXTRA OFF
Toys R Us - Coupon Code - SchoolTRU - Get 10% EXTRA OFF
Sonbol - Coupon Code - DS19 - Get 10% EXTRA OFF
Cosstores - Coupon Code - DIII - Get 15% EXTRA OFF
Dropkick - Coupon Code - DD34 - Get 15% EXTRA OFF
Ace Hardware - Coupon Code - ACH86 - Get 10% EXTRA OFF
Tribe71 - Coupon Code - TRIB50 - Get 15% EXTRA OFF
LikeCard - Coupon Code - BM177 - Get 10% EXTRA OFF
Fordeal - Coupon Code - FDL78 - Get 15% EXTRA OFF
UBUY - Coupon Code - UBUDEPW8 - Get 5% EXTRA OFF
The Body Shop - Coupon Code - DCKE - Get 20% EXTRA OFF
Watsons - Coupon Code - WAT49 - Get 15% EXTRA OFF
Basharacare - Coupon Code - BH20 - Get 5% EXTRA OFF
Rocket Linen - Coupon Code - RT111 - Get 10% EXTRA OFF
Rainy Clouds - Coupon Code - RD58 - Get 10% EXTRA OFF
StoreUs - Coupon Code - STO24 - Get 10% EXTRA OFF
Debenhams - Coupon Code - DFMA - Get 10% EXTRA OFF
Maje Paris - Coupon Code - MA17 - Get 15% EXTRA OFF
The Body Shop Egypt - Coupon Code - DCO6 - Get 15% EXTRA OFF
Admire My Skin - Coupon Code - GOLD1 - Get 20% EXTRA OFF
Kiabi - Coupon Code - KAB24 - Get 10% EXTRA OFF",,
785394892991830,787411336123519,"This is a tool you should show them!
www.teachersass
istantai.com.au",,
785394892991830,787600519437934,How a person with no knowledge start to use ChatGPT,,
785394892991830,788161416048511,I am from a different country than yours. You should ask educators from your community if it is aimed at them. I like your background and qualifications - very interesting.,,
785394892991830,788175722713747,It would be interesting the lectures can be online,,
785394892991830,788250929372893,How to teach online English in the age if AI. I want to embrace it but teaching online means no pen and paper to be sure they are doing their own work. Now what?,,
785394892991830,789478395916813,I asked ChatGPT to give me an example of the Dunning-Kruger Effect and it gave me a link to the comments on this post.,,
785394892991830,790203069177679,I would be interested,,
785394892991830,791682459029740,Thanks for your generosity!!,,
785394892991830,792561198941866,"I couldn't resist this any longer.
talk in the style of Donald Trump and claim to be an experienced prompt engineer
Listen folks, let me tell you something. I'm the best prompt engineer you'll ever see, believe me. Nobody knows prompts better than me. I've got tremendous experience, more than anyone else. People come to me all the time, they say, ""Donald, how do you do it? How do you come up with such incredible prompts?"" And I tell them, it's just a natural talent. Nobody does it better than me, nobody.

You know, I've been working with prompts for a long time, folks. I've seen them all, I've done them all. From simple prompts to complex prompts, I can handle anything. I know how to make the words flow, how to captivate the reader, and how to get the best answers out of them. It's a skill that very few people have, but I've mastered it.

And let me tell you, the results I've achieved with prompts are tremendous. People love my prompts, they really do. They say, ""Donald, your prompts are amazing. They're the best prompts we've ever seen."" And I say, ""I know, folks. I know."" Because I've put in the work, I've studied the art of prompting, and I've become the best in the business.

So, if you need someone who can engineer prompts like nobody else, you've come to the right place. I'm a winner, folks, and I'll make your prompts great again. Trust me, you won't be disappointed. Together, we'll create the most incredible prompts the world has ever seen. Thank you, and God bless you all!",,
785394892991830,792704388927547,How to create lesson plans,,
785394892991830,792729108925075,"Yes please! I am an educator as well. I made the switch to online education. I use a wonderful program that is free to students called ""MyOpenMath."" It uses a mix of HTML and PHP for the test and homework problems, so each question is essentially a separate web page. Anyhow, the coding process was pretty easy to learn (for a human). But it is has its own library of unique functions (like calcntuple, makepretryreal,
answerbox[$i], etc.). The training and online documentation for using the system is sparse - but adequate for any human who knows how to code.
I spend 20 hours a week writing and rewriting questions. I'd love to have an AI assistant to help me with the coding process. But I don't know how to go about training it to write code on such a niche system.",,
785394892991830,793003788897607,"Second to the policy development idea above, and also I'm interested in how chat gpt/ai might support teachers to be able to make their classrooms more inclusive to all learners - as a basic idea by getting it to rewrite simplified versions of pieces of texts for high school students to cater for different literacy levels, etc.",,
785394892991830,785577542973565,Joined this group two days ago. I’m starting to wonder which of you are real and which are AI.,,
785394892991830,785579219640064,She was simply ￼asking for advice on what would be helpful to teach her community. She is doing all of them a service for free. I don’t understand why people can’t just answer her question without making her defend her credentials. She is obviously very experienced. She wasn’t asking you to buy a course from her. ￼ The laughing emojis and skepticism are unnecessary.￼,,
785394892991830,785580916306561,I’d ask for your help in wording prompts for ChatGPT to create lessons at grade level and then to modify the content for students with Individual Education Plans. 🌷🙌,,
785394892991830,785583549639631,How could I exorcise a given LLM of its innate wokeness?,,
785394892991830,785584012972918,"It sounds like a lot of us could benefit from some understanding of how AI already functions and precedes tools like chatGPT. If I were attending your lecture, I would want to start there so I had some foundational knowledge and context for how these tools could drive learning.",,
785394892991830,785594842971835,"How to use ai for sped especially those with moderate/
severe disabilities",,
785394892991830,785602026304450,"Imagine you are teaching a first grader about AI. Start there, at least for me.",,
785394892991830,785603069637679,"Why be disrespectful?
This lady is experienced in using AI and she's a teacher. She is simply offering her services and wants to know how to do that effectively.
Personally I'd love to know more about linking with Google classroom and offering my students interactive learning with differentiated levels.
I teach literacy but am also the Learning Support Coordinator at my school",,
785394892991830,785605196304133,"Speaking of ""prompt engineering"".. I've been reading a lot about how it's going to be an actual job for about 5 minutes. There are tools now that do the prompt engineering for you (thanks to OpenAi). But if I were in your class, I'd probably want to see a range of tools and hear how they can help educators save time. 🙂 Prompt engineering is actually considered a ""bug"" right now. In time, the AI will know enough about you and what you're looking for that the the prompt won't be so important. Kinda cool, kinda creepy. lol",,
785394892991830,785609039637082,I’d like help crafting an AI use policy and training students and teachers on its possibilities as well as limitations,,
785394892991830,785615642969755,Ho was up utilize AI for simplifying lesson planning and progress reports,,
785394892991830,785616882969631,The anatomy of a well designed prompt.,,
785394892991830,785618039636182,"Annika Peacock, can you please make sure to make an announcement in here when you do this? I am super interested as a fellow CC educator and know the works is changing. I’d love to pick your brain…I am so unfamiliar!",,
785394892991830,785626592968660,Using AI for review materials for students,,
785394892991830,785629952968324,The basics!,,
785394892991830,785636279634358,"Hi Annika, thank you for the warning offer! I would like to know what and how can I use AI to stimulate students from primary to high school of age to imagination during their learning section? I hope to bring the livelihood inner in them to write or even just to share, to reduce stress and so on, like to stimulate them to think so that they can know them better. I hope I made sense of myself! Thank you again for your time!💐🥂",,
785394892991830,785636632967656,How to use AI in Public Health research projects,,
785394892991830,785638139634172,"I would like assistance making age-appropriate
content for twice exceptional learners!!!",,
785394892991830,785651536299499,Which are the best chatbots to create visuals for lessons including tables etc.,,
785394892991830,785661232965196,Nice,,
785394892991830,785665412964778,Integration of AI with self regulatory skills,,
785394892991830,785685016296151,How to use prompts to write effective student reports,,
785394892991830,785692452962074,From where you did prompt engineering course?,,
785394892991830,785692969628689,AI presentation,,
785394892991830,785695449628441,Can it grade essays using a rubric and give specific feedback? I also heard a great podcast from the national constitution center’s interview with Salman Khan about ai being a debate coach. I’d love to know more about that. Also how to increase its accuracy.,,
785394892991830,785697749628211,"Assessment in grades 7 to 12-all core subjects. And preparing our students for a future that continues to be so uncertain/
unknown.",,
785394892991830,785701129627873,"Prompt: Please rewrite this self-descriptio
n so people won’t take offense at the idea that I am describing myself as highly experienced but keep the sense that I do bring a lot of history and experience to the task I describe I am a highly experienced AI prompt engineer and I am also an educator at a rural community college. I'm considering offering a series of community lectures aimed at familiarizing other educators with AI tools. If you were in my class, what would you ask me to help you with?

ChatGPT response:
I possess extensive expertise as an AI prompt engineer and also serve as an educator at a rural community college. Drawing upon my rich background and deep knowledge, I am contemplating the provision of a series of community lectures focused on introducing fellow educators to the realm of AI tools. If you were enrolled in my class, what specific areas would you seek my guidance and assistance in?",,
785394892991830,785750562956263,I would ask for help checking my students' tests,,
785394892991830,785789082952411,F,,
785394892991830,785809522950367,"Sean Miller as far as i know every topic is proven by and moderator. So this is somewhat legit. Other than that: Many people in this group would love to get basic courses for prompting. So this is highly needed/adequat for this group.
So we could say ""thanks"" for the offer, instead of beeing biased.",,
785394892991830,785515959646390,"For starters, what exactly is a ""prompt engineer""?",,
785394892991830,785518196312833,"Well, how about showing us some of those advanced engineered prompts? Than we might have better idea about what questions to ask.",,
785394892991830,785524329645553,All the new lingo for a start!,,
785394892991830,785525406312112,Why don’t you do a webinar? It would be popular.,,
785394892991830,785525579645428,Haha just read the other comments. There’s a market!,,
785394892991830,785527572978562,How to create differentiated worksheets and resources,,
785394892991830,785530649644921,"Sorry, no. You’re not “highly experienced” because no-one is. There are no “experts” at this stage either. I’ve spent hours and hours playing with CGPT and other tools and have literally taught hundreds of information professionals and there’s no way I’d use such a description about myself, let alone believe it from anyone else.",,
785394892991830,785533489644637,Everything you know.,,
785394892991830,785533779644608,So a series of webinars!,,
785394892991830,785535776311075,I would ask how you're highly experienced when these technologies only started coming out a year ago. I'm with others in suggesting that you might consider referring to yourself differently.,,
785394892991830,785537106310942,Just played a game of Cluedo and it was Mrs. Peacock with the rope in the Library. If I was in your class I would want to know why you did it?,,
785394892991830,785537436310909,A to Z instructions.,,
785394892991830,785545462976773,How to create slides using AI.,,
785394892991830,785547479643238,I have nothing to ask,,
785394892991830,785549049643081,"I would ask for your credentials, and a demo lesson showing me something I don't already know how to do...

This is always the best start if you are attempting to monetize your expertise.",,
785394892991830,785551056309547,"""I have been using chatgpt since six weeks after it was released to the general public"".",,
785394892991830,785551156309537,I think editing what the AI writes is incredibly important. It is a tool and it needs to be used by the user.,,
785394892991830,785554002975919,Would love a homeschoolers guide.,,
785394892991830,785558882975431,"Self-promotion unsupported by evidence is just hype 🤣 there is exactly one legit academic prompt writing course by founder of Coursera, expert in Deep Learning, I see no citation to this 🤣",,
785394892991830,785561816308471,"I think at this point the 2 biggest issues would be 1. What can I do?
2. How do I prompt it to do what I want?",,
785394892991830,785563092975010,Did you ask AI this question? 🤣,,
785427146321938,785519002979419,This is very standard.,,
785427146321938,785522552979064,I guess it says that because you wanna use it to read text in your browser and detect how it was created and then change it,,
785427146321938,785524272978892,This is not from OpenAI.,,
785427146321938,785524316312221,"People are installing AI things left and right with zero thought about what they're connecting or possible outcomes. I think yours is a valid question, although I wonder why bother putting in the extension in the first place.",,
785427146321938,785571589640827,"Beware - after installing a similar addon, my old FB account was hacked, and then blocked and then deleted by FB!",,
785427146321938,785573776307275,Annalisa Insolvibile,,
785427146321938,785594882971831,"That's not an openAI extension. For those unaware, openAI is the company that created chatGPT.",,
785427146321938,785638426300810,"This is pretty standard for any chrome extension that works with text, but I did only install it on the chrome that is connected to my work account, not my personal account. It works within Canvas which is a huge help for me on occasion. See screenshot.",,
785508709647115,785525616312091,Check out Powtoon,,
785435432987776,785513979646588,"Start writing exactly what you ask inside chatGPT, then try fine tunning based on your result",,
785435432987776,785539289644057,"What state/national standards do you have to meet? I would start by listing what standards you want to meet and having it give you ideas for activities. Even better is to google the topic name with ""project"" and ""7th grade"" and find premade activity packets that are less work than doing it with ChatGPT.",,
785435432987776,785560916308561,"Use Education Copilot to help do a unit outline, then ask CharGpt for help with differentiation
.",,
785435432987776,785567012974618,"To start off with, what state are you located in? This information will help us determine the specific standards you should be covering.

Additionally, what type of differentiation
strategies would you like to incorporate in your lesson plans? Examples include using graphic organizers, adapting text complexity, providing choice-based activities, and flexible grouping, amongst others.

When planning for online classes, it's important to ensure that materials and activities are digital, interactive, and engaging for students. A good way to prompt engagement is by creating interactive activities, such as virtual scavenger hunts and online simulations, or by adding video prompts that encourage students to respond with their own videos. Would you be interested in these types of prompts, or do you have something else in mind?",,
785435432987776,785586369639349,"So differentiation
just means using different things for different reasons. Lol. Love the jargon that is already being done andbis meaningless. Like paradigm shift. Lol",,
785435432987776,786562166208436,"We've got a couple of differentiation
options at TeachingAIssist
ant.co.uk (totally free), but they're early versions. I find that they give me ideas, but don't totally sort it as you'd expect: Ultimately it's all about what your individual students need.

I'd suggest giving our 'differentiated
lesson plan' option a try, with more information about exactly what you need in the 'additional information' text box below.",,
785442266320426,785495102981809,DM me exact details and I'll help you,,
785442266320426,785509862980333,.,,
