Post ID,Comment ID,Comment Text,Author,Parent Comment ID
786537446210908,786675406197112,This is really cool!!,,
786537446210908,787050009492985,Beth Hunter Baldwin We're glad you like it!,,786675406197112
786537446210908,786680899529896,I just tried it and it's a time saver. Thanks a lot.,,
786537446210908,787129769485009,Salinas Rolando You're welcome!,,786680899529896
786537446210908,786682236196429,Lol,,
786537446210908,787129569485029,Israel Montoya 😁,,786682236196429
786537446210908,786683529529633,Bronwyn Lieschke this could become really useful!,,
786537446210908,787049926159660,Anna Muir Please do give it a try and see what you think. :-),,786683529529633
786537446210908,786687932862526,Hello,,
786537446210908,786759332855386,I tried it. It‘s Not free of charge,,
786537446210908,786783219519664,"Bea Te Hi Bea! The lesson resource generator is free, on the front page, and always will be.",,786759332855386
786537446210908,786765556188097,"used it today for a lesson plan for junior art class, was fantastic",,
786537446210908,787049812826338,Lisa Kreemers Hi Lisa! Glad it's useful. :-),,786765556188097
786537446210908,786782379519748,Do you have a link? I can't find it.,,
786537446210908,786783789519607,"Annie Smitherz It's teachingAIssist
ant.co.uk 👍",,786782379519748
786537446210908,786784992852820,Thank you,,
786537446210908,787050959492890,Nicky Van Der Haer You're welcome. 👍,,786784992852820
786537446210908,786798689518117,Great to see a UK based AI tool. Exciting stuff! Wondering if you have had a look at the Scottish Curriculum for Excellence? - Primary teacher.,,
786537446210908,786801252851194,"Thanks! I don't think we've had a detailed look at any of the Scottish curricula yet. We're mostly secondary teachers on the team, so any input from primary colleagues on what they'd like to see / how it ought to be tweaked is very welcome.",,786798689518117
786537446210908,786813049516681,"Charles Scullion the Primary Curriculum is massive of course. Well worth the effort looking into it. Am part of 33k membership of an inquisitive and motivated Scottish Primary Teachers FB group.
Your first stop is an overview see https://
education.gov.sc
ot/improvement/
learning-resourc
es/
curriculum-for-e
xcellence-bench
marks/

Maybe an online survey for us?
Personally interested in differentiated resources for Primary literacy (phonics / spelling/ reading) We're all about motivating contexts with meaningful follow-up. Worksheets useful but not the only way of demonstrating learning. Consider motivating contexts such as Pie Corbett’s Reading Spine.

Also big for my urban school is INCLUSION hence the need for differentiation
. Feel like there's a gap for quality ASN/ EAL (English as an Additional Language) pictorial supports for lesson plans to support learning and Immersion in the language e.g.vocabulary set templates which could be built on by pupils through A.T. perhaps on IPad with Keynote or Pages.",,786798689518117
786537446210908,787050872826232,"Thanks, Fran! We actually started with the idea of using ChatGPT or similar tools for inclusion /
differentiation. That's a trickier problem to solve with the tech, but we've had some promising trials already in lessons. We'll keep you all updated. 😃",,786798689518117
786537446210908,786819309516055,When i clicked the link it said $5.99 GBP????,,
786537446210908,786830426181610,"Hi Francesca. The lesson planner is available on the front page, totally free and without sign up - and always will be. We've added the option for people to join as supporters because otherwise we'll be losing quite a bit of money each month on server costs. Joining as an Early Access Supporters has some benefits, but is 100% optional. Hope that makes sense!",,786819309516055
786537446210908,786861666178486,I just tried the link. I had to sign up - fair enough - and the n was asked for a credit card number. The blurb said free!,,
786537446210908,786861899511796,Just scroll down a bit more. It's totally free. :-),,786861666178486
786537446210908,786862422845077,Belinda Joy,,
786537446210908,786878252843494,I hope it will stay free or a small one time payment. I have too many different teaching related monthly subscriptions and it’s getting out of hand. Maybe a free with ads option would give you the benefits you deserve? (Like Spotify & Facebook),,
786537446210908,786886826175970,We will always keep the basic lesson planner available and free. 👍,,786878252843494
786537446210908,787122259485760,"Charles Scullion I gave it a try. Layout was good but the suggestions were a bit blah. I asked for ideas for creativity in computer class and was given things like Scratch which everyone would know already.

I’ll think of something else and have another go",,786878252843494
786537446210908,787132386151414,"I see what you mean: It really likes Scratch doesn't it? 😁

I'll have a look at that resource type and see what can be done to improve it. 👍",,786878252843494
786537446210908,786887159509270,"We've updated the site based on your feedback. Thanks, guys.",,
786537446210908,786902842841035,When you sign up it’s looking for bank card details .?,,
786537446210908,786912139506772,Just scroll down - no sign up needed.,,786902842841035
786537446210908,786909649507021,VL Bottroff,,
786537446210908,786911202840199,Awesome. Look forward to testing.,,
786537446210908,787082402823079,"Leon Rey Great, hope it's useful!",,786911202840199
786537446210908,787025909495395,"Use the code 'THANKS' to get first month free, as a thank you for sharing. 👍",,
786537446210908,787070059490980,This is very cool 😎,,
786537446210908,787078416156811,Craig Giese Glad you like it! :-),,787070059490980
786537446210908,787214049476581,"So, I just had a go at asking your teaching aissistant to create for me a comprehension text and question worksheet for beginner Spanish students that includes multiple choice, true/false and short answer questions on a specific topic we are learning about - and I am quite pleased with the result! It definitely saved me time typing it all out myself and coming up with questions etc. Well done Charles!!",,
786537446210908,787299986134654,Tay Nicole Great! I'm glad it's useful. 😁,,787214049476581
786537446210908,787216842809635,Thanks,,
786537446210908,787233689474617,Thanks,,
786537446210908,787304472800872,Deborah Butler No problem - I hope it's useful! 👍,,787233689474617
786537446210908,787284516136201,THANKS,,
786537446210908,787304419467544,You're welcome :-),,787284516136201
786537446210908,787332519464734,Thank you for sharing!!!,,
786537446210908,787362552795064,Susan Mahgoub You're welcome!,,787332519464734
786537446210908,787655869432399,We've made a few more changes to the user interface in response to feedback this evening. Thanks all!,,
786537446210908,788578619340124,"Just registered. Great tool, I am discovering more ways to create activities for my subjects and my husband is also finding this great for his one. Happy family here!
Thank you 😊",,
786537446210908,788633112668008,That's great - we're so glad you're finding it useful. Keep an eye out for a couple new resource types and features over the next week or so. 👍,,788578619340124
786537446210908,788727619325224,"We've added a frequently asked questions page, which I think addresses a couple of the things people have messaged me asking about. https://
www.teachingaiss
istant.co.uk/
faq 👍",,
786537446210908,788886552642664,Aram Marquez,,
786537446210908,789522669245719,My new favourite resource type is the 'upgrade my lesson' careers option. Perfect for this week when my head of department wants a careers activity in every unit for next year. 👍,,
786537446210908,786546226210030,This is insane ! Can open up doors for a lot of other platforms,,
786537446210908,787082502823069,Mauricio Leon Glad you like it! :-),,786546226210030
786537446210908,786549686209684,Where can we find it to try it out?,,
786537446210908,786550619542924,"Kristin Reksten It's TeachingAIssist
ant.co.uk",,786549686209684
786537446210908,786552579542728,Thanks!,,786549686209684
786537446210908,786551126209540,"subscribe for new AI tools review every day:https://
www.youtube.com/
channel/
UC3lrGFOiuq0XJLn
FTkj8p6Q",,
786537446210908,786553712875948,Wow!!!! I just tried it and it's definitely great tool to save time in initial planning! Thanks,,
786537446210908,786555649542421,"Rukiya Issa I think that's a really good way to think about it. I'm finding that TeachingAIssist
ant gives me a starting point, and then I polish it up so it's right for my class

We're giving a lot of thought to simple ways to make it more personalised right from the start though, to save some of that polishing time.",,786553712875948
786537446210908,786574059540580,"Charles Scullion That would be cool! As an instructional coach, I see it helping teachers develop their skills more faster and ignite creativity as well. I liked that there is option to choose lesson plan type! I think 21st century skills and inquiry based learning can be another option too!",,786553712875948
786537446210908,786575392873780,Charles Scullion I think lesson objectives would help to make it more specific and reduce polishing time. If a teacher can input then let the AI do its part.,,786553712875948
786537446210908,786561479541838,There's no link.,,
786537446210908,786562696208383,Sara Marie Sorted :-),,786561479541838
786537446210908,786562666208386,..ok thanks Charles. I found it. Yippee,,
786537446210908,786563569541629,"Allon Noriel It's TeachingAIssist
ant.co.uk 👍",,786562666208386
786537446210908,786564859541500,Charles Scullion,,786562666208386
786537446210908,786564006208252,Thank you! ✨️,,
786537446210908,787104189487567,Iwana IZ You're welcome!,,786564006208252
786537446210908,786564029541583,Awesome! I look forward to checking it out!,,
786537446210908,787078492823470,"Tonya Donahue Great, we hope you find it useful!",,786564029541583
786537446210908,786570066207646,Betina Schaff,,
786537446210908,786571746207478,Rebecca Ks,,
786537446210908,786596452871674,Sam Holmes haha I just tagged you in this,,786571746207478
786537446210908,786573476207305,yess got the results,,
786537446210908,787104119487574,Geevan George Great!,,786573476207305
786537446210908,786574942873825,thank you,,
786537446210908,787104079487578,Geevan George You're welcome!,,786574942873825
786537446210908,786582452873074,"awesome guys! If you wanna chat, I built a full suite platform in Australian platform with over 50 tools similar style (similar name 😉)
www.teachersass
istantai.com.au",,
786537446210908,786596386205014,Sam Holmes,,
786537446210908,786606999537286,Is it linked to a UK curriculum or other countries too?,,
786537446210908,786615446203108,"Annelies Resink Hi Annelies! We teach in the UK, but you can put your own country and course in the 'Subject and Specification' box and it will do it's best. We're working to tailor responses further for a couple of courses that we teach on to start with, then looking to roll it out farther afield.",,786606999537286
786537446210908,786608432870476,Thank you for sharing!,,
786537446210908,787050469492939,Sandra Climent You're welcome 👍,,786608432870476
786537446210908,786623069535679,Thank you for sharing!,,
786537446210908,787616159436370,Donna Bianchi You're welcome 🤗,,786623069535679
786537446210908,786627719535214,Thank you for sharing!,,
786537446210908,787616119436374,김수희 You're welcome 🙂,,786627719535214
786537446210908,786628789535107,Paula Thomas,,
786537446210908,786635462867773,Found it it's working,,
786537446210908,786635772867742,Very interesting!,,
786537446210908,786642809533705,Adeoye Abayomi Excel excel na the stuff be this,,786635772867742
786537446210908,786970046167648,Adejoke Balogun Ajayi yeah,,786635772867742
786537446210908,786647316199921,Renata Loza,,
786537446210908,787400869457899,Karima Zarour Badawi I will try it. Thanks so much,,786647316199921
786537446210908,786657076198945,Had a wee play with this. Very good. I can really see the benefits of this. Well done to you.,,
786537446210908,786657786198874,"Thanks, Colin. :-)",,786657076198945
786537446210908,786658026198850,Charles Scullion no problem. Genuinely like the idea and what it can do. I did a little test and it was spot on. Made a lovely glossary for me.,,786657076198945
786537446210908,786660776198575,Charles Scullion what do you teach?,,786657076198945
786537446210908,786661789531807,I'm a Science teacher. 👍,,786657076198945
786537446210908,787633639434622,Colin Murphy it's a great tool for lesson prep! Saves so much time!,,786657076198945
786537446210908,787652142766105,Amanda Burland I'm glad you're finding it useful! Are there any resource types you find particularly helpful?,,786657076198945
786537446210908,786657666198886,Sharon Hibbert,,
786537446210908,786659102865409,it say it is closed.,,
786537446210908,786659836198669,Hi Jonny! The lesson resource generator is right on the homepage. 👍,,786659102865409
786537446210908,786978969500089,Charles Scullion ah. Thank you so much for that.,,786659102865409
786537446210908,786660752865244,Will it find images for kids ppts for vocabulary?,,
786537446210908,786661419531844,"Sui Lee Hi Sui. We haven't added support for images yet. It's on the list of features we want to implement though! At the moment, we want to make sure we can get enough support to keep the servers running. 😁 Thanks so much for your interest.",,786660752865244
786537446210908,786681522863167,Charles Scullion what do you type for specific actions?,,786660752865244
786537446210908,786669796197673,Thanks to everyone who has been trying out the Teaching AIssistant lesson planner! I hope you find it useful in your teaching. 😃,,
786537446210908,786673722863947,"This is fantastic, well done! Would be great if you could produce an assessment tool as well where you upload the document and it marks it based on a mark scheme or rubric. Great job!",,
786537446210908,786674402863879,That's on the road map. 😁,,786673722863947
786537446210908,786675029530483,"Charles Scullion superb, glad to hear it! Build it into Google classroom and you'll be very popular indeed!",,786673722863947
786537446210908,787050356159617,It was actually a rather painful Google Forms marking experience (with extended response questions - ugh) that inspired some of the ideas for this tool. 😁,,786673722863947
786392766225376,786595592871760,Nicola Carrigan,,
786392766225376,786602446204408,So cool!!,,
786392766225376,786606626203990,Amanda Thepanda impressive to say the least!,,786602446204408
786392766225376,786633809534605,I almost feel sorry that i don't need it professionally 😅,,
786392766225376,786775942853725,Татьяна Евдокимова :p,,786633809534605
786392766225376,786670172864302,"I tried firefly today and while the beta is still limited, it looks like a good competitor to midjourney. Got decent results with very minimal and intuitive prompts.",,
786392766225376,786775892853730,"Annika Peacock, it's not as good as Midjourney yet. However, keep in mind they serve different purposes.",,786670172864302
786392766225376,786673012864018,This is awesome!,,
786392766225376,786775602853759,Kun Cao yeah! :),,786673012864018
786392766225376,786709646193688,It's such an exciting time to be alive!,,
786392766225376,786775709520415,Karen Corsello AI is advancing rapidly,,786709646193688
786392766225376,786814769516509,Penny Nakhle thought this might interest some of your teaches? 🙅🏻‍♀️,,
786392766225376,786880599509926,Lyn Walkerden,,
786392766225376,786880669509919,April Dee,,
786392766225376,786900492841270,Stacey - have you seen this???,,
786392766225376,786994492831870,"Yes, its pretty wild",,786900492841270
786392766225376,787072779490708,"Gillian, Conor....",,
786392766225376,787132439484742,Sam William,,
786392766225376,787398532791466,"Wait, is this a feature within PS or a new program?",,
786392766225376,787426909455295,"Firefly is a creative, generative AI engine. It’s just landed in Adobe Photoshop. More here: https://
www.adobe.com/
sensei/
generative-ai/
firefly.html",,787398532791466
786392766225376,787779376086715,"Wow,I love this",,
786392766225376,787812636083389,Paulette Lambert it's super handy,,787779376086715
786392766225376,788004666064186,David James,,
786380329559953,786696809528305,How do you enter the essay?! 🙏,,
786380329559953,786701346194518,Did all the students use the same prompt to get feedback on their essays?,,
786380329559953,786701629527823,Melynda Heller,,
786380329559953,786712802860039,I'm grateful for your kindness Now i can pay for my medication and also be able to help get back on my feet. You're God sent thank you so much 👉 Adz Louis,,
786380329559953,786724109525575,"I’m very pleased to celebrate my payout with everyone In this page. Indeed I’m happy and is really genuine paying broker, the whole world needs to know how good and generous she is. Adz Louis",,
786380329559953,786727896191863,Leanne Jones,,
786380329559953,786783352852984,"Maria Fountouki Just what you were talking about with the feedback. 🙂
Somewhere on this thread it was mentioned that you need parents’ permission to use ChatGPT if you’re under 18, and you need to click something in order to prevent students’ work from being added to their database (or something like that). I feel like we need some guidance from the IT department.",,
786380329559953,786794712851848,İf students do his and then use Turnitin the essay May be flagged up as 100% ai. That is what one of my students claimed. Can this be true?,,
786380329559953,786833906181262,Simon Anable,,
786380329559953,786853682845951,Jesse Lee game changer,,
786380329559953,786896859508300,"This is such a great concept to share. So many discuss the ‘generative’ nature of AI, but the ‘evaluative’ component is HUGE!",,
786380329559953,786963266168326,What grade level,,
786380329559953,787082562823063,"Well done! Congrats! I have the same approach here. For my future teacher students it was also an exponential grow of creativity how to engage learners into any subject topic!!!! ChatGPT helped them to go beyond their bonderies, helped them bilieve that they can find out interesting and engaging taks for their learners.",,
786380329559953,787122656152387,To get AI content to appear human just misspell a word use incorrect punctuation.,,
786380329559953,787153416149311,Antonis Pagonis how cool,,
786380329559953,787164672814852,Professionals are using ChatGPT to edit letters and emails already. This will only increase and I think it will be the standard in just a few years. Students definitely need to learn how to use this tool to be able to be as efficient as their coworkers in the future.,,
786380329559953,787174799480506,"Heres an exampe of using it for draft feedback:
you are a year 10 English teacher. students are asked to create a 5-8 minute persuasive presentation on this task:

""Choose a concept from macbeth and persuade your teenage audience that this concept is vital to living a good life and being a good person as part of a community.""

Provide clear, direct advice, written in the 2nd person, with subheadings by using the criteria listed below. Use analogies when needed and emhphasize tips that will make this an enagaging persuasive speech. included recommendations
of ethos, pathos and logos techniques they could include. Criteria: 1.1 Discerning creation of perspectives and representations
of concepts, identities, times and places in a persuasive text. 1.2 Discerning use of the ways cultural assumptions, attitudes, values and beliefs underpin texts and invite audiences to take up positions. 1.3 Discerning use of aesthetic features and stylistic devices to achieve persuasive purposes. 2.1 Discerning use of the patterns and conventions of a persuasive text, and of the role of the speaker/signer/
designer, to achieve a particular purpose. 2.2 Discerning selection and synthesis of subject matter to support perspectives. 2.3 Discerning organisation and sequencing of subject matter to achieve a particular purpose, including discerning use of cohesive devices to emphasise ideas and connect parts of a persuasive text. 3.1 Discerning language choices for particular purposes. 3.2 Discerning combination of a range of grammatically accurate/
appropriate language structures to achieve particular purposes.

Student work: """,,
786380329559953,787253199472666,I absolutely love this idea. I will use this idea in my HS math class this fall.,,
786380329559953,787276696136983,Amazing.,,
786380329559953,787688492762470,Love this!❤️Following,,
786380329559953,787761496088503,You may ask AI to check the grammatical errors and bracket the errors with corrections. This is not rewriting.,,
786380329559953,787796572751662,"Another add on to the prompt - get it to give you the feedback chronologically
. That way it gives the feedback on the piece of writing from start to finish in logical order.",,
786380329559953,787978632733456,"Offended? If a student feels offended when you show him the right way. He should to a psychotherapist
immediately",,
786380329559953,788229716041681,Lauren Jennifer,,
786380329559953,788493686015284,I don't think that what you are paid for !,,
786380329559953,788510216013631,F,,
786380329559953,788986325966020,"Okay, but what about giving feedback on the bigger text? I need an analysis of the article from one of the year law review and the article is like 50 pages. Putting the hole article didn't help at all. What would you recommend? I have tried to split it into passages but it also didn't help. After second or third passage it started to reply on the input text, however I asked chatgpt ""just read without giving any feedback until I ask you for it"".",,
786380329559953,789828082548511,"You know, I tried getting feedback from ChatGPT on a student essay response once, just to see what happened. The good part was that the AI came up with some good suggestions. (I later found out it gave these suggestions for almost all students.) However, there was a statement the student had made which was not well written and which the AI interpreted incorrectly. As a human, I could figure out what she really meant, but the AI was stumped.",,
786380329559953,789926622538657,Would it be ok if I share a screenshot of your post with teachers?,,
786380329559953,792228758975110,Brian Earl Annette Logan James Fisher,,
786380329559953,786397556224897,Love this,,
786380329559953,786398196224833,"This is dope! Instead of trying to stop it, which we can’t, use it. Great post!",,
786380329559953,786398796224773,"You people realize you’re doing yourselves out of a job, right? Oh sure, we all know that AI can never replace the individualized attention and expertise of a teacher - but will the higher ups know that?",,
786380329559953,786403949557591,Richard Smith,,
786380329559953,786405212890798,"Lacey, Jamie…",,
786380329559953,786405529557433,"I know we can’t stop progress or ever evolving technology, but AI/ChatGPT gives me Hal “2001: A Space Odyssey” vibes. 🤔",,
786380329559953,786406526224000,Once the kids realise you just need to leave out the word 'don't' from the prompt then all in vain. Good effort though I'm glad you're encouraging them to use it as a personal assistant 👍 AI apps are incredible at coding prompts so it's going to be interesting teaching A-Level Computer Science next year.,,
786380329559953,786409786223674,"I can't get it to stop rewriting the essay/
paragraph--even though I ask it NOT to rewrite. I used the prompt you suggested--stil
l rewrote the paragraph.",,
786380329559953,786414859556500,"https://
PocketAI.online/ takes the approach a step further and uses the exact assignment and grading rubric into account before giving students feedback. It's much more specific feedback.",,
786380329559953,786414872889832,Hur vet du att den första essän inte är skriven av AI?,,
786380329559953,786418056222847,My student who cannot get past his phobia of writing has mastered editing through chat to the point he is now able to write freely and tell chatgpt exactly what he wants.,,
786380329559953,786432036221449,Thank you!,,
786380329559953,786439186220734,"Deborah Feigenson, can you share a simple doc. explaining how to do this?",,
786380329559953,786446572886662,Deborah Feigenson how to do this if the student writing is on paper. ? My students write on paper. They don’t have individual iPads,,
786380329559953,786454009552585,"Sorry, but it isn"" t I' ve just sat down?! 😋🥰",,
786380329559953,786471559550830,"So, how do you do it?",,
786380329559953,786485532882766,Can you explain this to us please?,,
786380329559953,786487532882566,Please share the process. Do you have the prompt?,,
786380329559953,786495102881809,"I would definitely not have them submit an essay 3-4 times. 2 times, at best. When you ask ChatGPT to give feedback, it will give feedback. Don't forget that it will never get to a point where it says, ""Well! Looks great! I think you're done, now!""

I've used it for my own feedback on my written documents and the feedback can sometimes feel very forced and not authentic.

I am just expressing the current limitations. Students should know. But it's a great tool for feedback once or twice.",,
786380329559953,786516819546304,Sara Mollison,,
786380329559953,786517482879571,What prompt did you give it to do this? Would you mind sharing?,,
786380329559953,786549306209722,If you put your own essay in university Chat GBT is it considered plagiarism ?,,
786380329559953,786574376207215,Marion Porteous,,
786380329559953,786588646205788,Thank you for sharing,,
786380329559953,786608382870481,Great idea!!,,
786380329559953,786616136203039,F,,
786380329559953,786626616201991,Matt Boone,,
786380329559953,786626659535320,Blocked in my district,,
